"","feed_pub_date","item_title","item_description","item_link"
"1",2021-01-20 17:43:26,"Polska kupi dodatkowo 25 mln dawek szczepionki Pfizer/BioNTech - Wyborcza - Katowice","Polska kupi dodatkowo 25 mln dawek szczepionki Pfizer/BioNTech&nbsp;&nbsp;Wyborcza - KatowiceSzefowa KE stanowczo o opóznieniach w dostawach szczepionek Pfizer/BioNTech - rynki zagraniczne&nbsp;&nbsp;WNP.PLPandemia koronawirusa. Pfizer i BioNTech opracowaly plan zwiekszenia produkcji szczepionek w Europie | TVP Info&nbsp;&nbsp;TVP InfoPfizer zapowiada zwiekszenie dostaw szczepionek. Chodzi o dwa terminy&nbsp;&nbsp;Gazeta.plPolska zamówila kolejne 25 mln szczepionek Pfizer i BioNTech&nbsp;&nbsp;wPolityce.plZobacz wszystkie materialy w aplikacji Wiadomosci Google","https://katowice.wyborcza.pl/katowice/7,35063,26706207,polska-kupi-dodatkowo-25-mln-dawek-szczepionki-pfizer-biontech.html"
"2",2021-01-20 17:43:26,"Niemcy zaczynaja produkcje szczepionek Pfizer i BioNTech. Na rynek ma trafic 750 mln dawek - Money.pl","Niemcy zaczynaja produkcje szczepionek Pfizer i BioNTech. Na rynek ma trafic 750 mln dawek&nbsp;&nbsp;Money.plPfizer/BioNTech zmniejsza dostawy szczepionki przeciw Covid-19 do Europy: Podano daty&nbsp;&nbsp;RMF 24Opóznienia w dostawach szczepionki Pfizer/BioNTech potrwaja do 25 stycznia. Dostawy do Polski spadna o 40 proc.&nbsp;&nbsp;BusinessInsiderPfizer i BioNTech: 25 stycznia powrót do zaplanowanych dostaw szczepionek. Od 15 lutego beda zwiekszone&nbsp;&nbsp;Wiadomosci Gazeta.plDostawy szczepionek Pfizer: BioNTech beda opóznione - rynki zagraniczne&nbsp;&nbsp;WNP.PLZobacz wszystkie materialy w aplikacji Wiadomosci Google","https://www.money.pl/gospodarka/niemcy-zaczynaja-produkcji-szczepionek-pfizer-i-biontech-na-rynek-ma-trafic-750-mln-dawek-6597585062820832a.html"
"3",2021-01-20 17:43:26,"Biontech/Pfizer chce zwiekszyc produkcje szczepionki. To nie takie proste - DW (Polski)","Biontech/Pfizer chce zwiekszyc produkcje szczepionki. To nie takie proste&nbsp;&nbsp;DW (Polski)","https://www.dw.com/pl/biontech-pfizer-chce-zwi%C4%99kszy%C4%87-produkcj%C4%99-szczepionki-to-nie-takie-proste/a-56111217"
"4",2021-01-20 17:43:26,"EMA: kazda fiolka szczepionki Pfizer/BioNTech zawiera szesc dawek - Bankier.pl","EMA: kazda fiolka szczepionki Pfizer/BioNTech zawiera szesc dawek&nbsp;&nbsp;Bankier.pl","https://www.bankier.pl/wiadomosc/EMA-kazda-fiolka-szczepionki-Pfizer-BioNTech-zawiera-szesc-dawek-8033496.html"
"5",2021-01-20 17:43:26,"Szczepienia przeciw COVID-19. Zaszczepiony czy ozdrowieniec - kto jest lepiej chroniony? - BusinessInsider","Szczepienia przeciw COVID-19. Zaszczepiony czy ozdrowieniec - kto jest lepiej chroniony?&nbsp;&nbsp;BusinessInsider","https://businessinsider.com.pl/technologie/nauka/szczepionka-na-koronawirusa-liczba-przeciwcial-pfizer-biontech-wyniki-z-izraela/6sfpryy"
"6",2021-01-20 17:43:26,"Chinska firma chce produkowac szczepionki Pfizer-BioNTech - Bankier.pl","Chinska firma chce produkowac szczepionki Pfizer-BioNTech&nbsp;&nbsp;Bankier.pl","https://www.bankier.pl/wiadomosc/Chinska-firma-chce-produkowac-szczepionki-Pfizer-BioNTech-8029742.html"
"7",2021-01-20 17:43:26,"Pierwsza dawka szczepionki firm Pfizer/BioNTech ogranicza infekcje o 33-60 proc. - wirtualnemedia.pl","Pierwsza dawka szczepionki firm Pfizer/BioNTech ogranicza infekcje o 33-60 proc.&nbsp;&nbsp;wirtualnemedia.pl","https://www.wirtualnemedia.pl/artykul/pierwsza-dawka-szczepionki-pfizer-biontech-jak-dziala-ogranicza-infekcje-o-33-60-proc"
"8",2021-01-20 17:43:26,"UE zdecydowala o zakupie dodatkowych 100 mln dawek szczepionki BioNTech i Pfizer - Bankier.pl","UE zdecydowala o zakupie dodatkowych 100 mln dawek szczepionki BioNTech i Pfizer&nbsp;&nbsp;Bankier.pl","https://www.bankier.pl/wiadomosc/UE-zdecydowala-o-zakupie-dodatkowych-100-mln-dawek-szczepionki-BioNTech-i-Pfizer-8028592.html"
"9",2021-01-20 17:43:26,"Fabryka Pfizer/BioNTech pod zwiekszona kontrola policji. Obawiaja sie ataków terrorystycznych - RMF 24","Fabryka Pfizer/BioNTech pod zwiekszona kontrola policji. Obawiaja sie ataków terrorystycznych&nbsp;&nbsp;RMF 24","https://www.rmf24.pl/raporty/raport-koronawirus-z-chin/szczepienia-przeciw-covid19/news-fabryka-pfizer-biontech-pod-zwiekszona-kontrola-policji-obaw,nId,4979816"
"10",2021-01-20 17:43:26,"Meksyk: Lekarka po otrzymaniu szczepionki Pfizer/BioNTech trafila do szpitala - RMF 24","Meksyk: Lekarka po otrzymaniu szczepionki Pfizer/BioNTech trafila do szpitala&nbsp;&nbsp;RMF 24","https://www.rmf24.pl/raporty/raport-program-szczepien-przeciw-covid/news-meksyk-lekarka-po-otrzymaniu-szczepionki-pfizer-biontech-tra,nId,4962873"
"11",2021-01-20 17:43:26,"Szczepionka Pfizer/BioNTech prawdopodobnie skuteczna równiez wobec mutacji koronawirusa - Forsal.pl","Szczepionka Pfizer/BioNTech prawdopodobnie skuteczna równiez wobec mutacji koronawirusa&nbsp;&nbsp;Forsal.pl","https://forsal.pl/lifestyle/zdrowie/artykuly/8073458,szczepionka-pfizerbiontech-prawdopodobnie-skuteczna-rowniez-wobec-mutacji-koronawirusa.html"
"12",2021-01-20 17:43:26,"Rekomendacja WHO ws. szczepionki Pfizer-BioNTech - RMF 24","Rekomendacja WHO ws. szczepionki Pfizer-BioNTech&nbsp;&nbsp;RMF 24","https://www.rmf24.pl/raporty/raport-program-szczepien-przeciw-covid/news-rekomendacja-who-ws-szczepionki-pfizer-biontech,nId,4968703"
"13",2021-01-20 17:43:26,"Szczepionka przeciw COVID-19 Pfizer i BioNTech: kto moze ja przyjac, a kto nie? Rekomendacje WHO - Puls Medycyny","Szczepionka przeciw COVID-19 Pfizer i BioNTech: kto moze ja przyjac, a kto nie? Rekomendacje WHO&nbsp;&nbsp;Puls Medycyny","https://pulsmedycyny.pl/szczepionka-przeciw-covid-19-pfizer-i-biontech-kto-moze-ja-przyjac-a-kto-nie-rekomendacje-who-1105736"
"14",2021-01-20 17:43:26,"Pelna charakterystyka szczepionki przeciw COVID-19 od Pfizer/BioNTech - politykazdrowotna.com","Pelna charakterystyka szczepionki przeciw COVID-19 od Pfizer/BioNTech&nbsp;&nbsp;politykazdrowotna.com","https://www.politykazdrowotna.com/68415,pelna-charakterystyka-szczepionki-przeciw-covid-19-od-pfizerbiontech"
"15",2021-01-20 17:43:26,"Dworczyk: Moderna moze dostarczyc okolo 800 tys. dawek szczepionki do konca marca - BusinessInsider","Dworczyk: Moderna moze dostarczyc okolo 800 tys. dawek szczepionki do konca marca&nbsp;&nbsp;BusinessInsider","https://businessinsider.com.pl/wiadomosci/dostawy-szczepionek-na-covid-19-do-polski-pfizer-biontech-i-moderna/p0k44f3"
"16",2021-01-20 17:43:26,"Norweska Agencja, Pfizer i BioNTech o smiertelnych przypadkach po szczepieniu - Cowzdrowiu","Norweska Agencja, Pfizer i BioNTech o smiertelnych przypadkach po szczepieniu&nbsp;&nbsp;Cowzdrowiu","https://cowzdrowiu.pl/aktualnosci/post/norweski-urzad-i-pfizer-o-smiertelnych-przypadkach-po-szczepieniu"
"17",2021-01-20 17:43:26,"Pfizer i BioNTech zabieraja glos w sprawie dostaw szczepionki Comirnaty na rynek UE - Cowzdrowiu","Pfizer i BioNTech zabieraja glos w sprawie dostaw szczepionki Comirnaty na rynek UE&nbsp;&nbsp;Cowzdrowiu","https://cowzdrowiu.pl/aktualnosci/post/pfizer-o-dostawach-szczepionki-na-rynek-europejski"
"18",2021-01-20 17:43:26,"Powrót do pierwotnego harmonogramu dostaw szczepionek. Pfizer i BioNTech podaly termin - polsatnews.pl","Powrót do pierwotnego harmonogramu dostaw szczepionek. Pfizer i BioNTech podaly termin&nbsp;&nbsp;polsatnews.pl","https://www.polsatnews.pl/wiadomosc/2021-01-15/firma-pfizer-poinformowala-kiedy-powroci-do-pierwotnego-harmonogramu-dostaw-szczepionek/"
"19",2021-01-20 17:43:26,"KE chce zamówic wiecej dawek szczepionki przeciw Covid-19 od firm Pfizer i BioNTech - 300GOSPODARKA","KE chce zamówic wiecej dawek szczepionki przeciw Covid-19 od firm Pfizer i BioNTech&nbsp;&nbsp;300GOSPODARKA","https://300gospodarka.pl/live/ke-chce-zamowic-wiecej-dawek-szczepionki-przeciw-covid-19-od-firm-pfizer-i-biontech"
"20",2021-01-20 17:43:26,"Wegry zatwierdzily rosyjska szczepionke na koronawirusa? – EURACTIV.pl - EURACTIV Poland","Wegry zatwierdzily rosyjska szczepionke na koronawirusa? – EURACTIV.pl&nbsp;&nbsp;EURACTIV Poland","https://www.euractiv.pl/section/bezpieczenstwo-i-obrona/news/wegry-rosja-szczepionka-koronawirus-sputnik-v/"
"21",2021-01-20 17:43:26,"BioNTech i Pfizer bliskie wypuszczenia szczepionki na rynek. „Najlepsza wiadomosc w okresie pandemii” - DW (Polski)","BioNTech i Pfizer bliskie wypuszczenia szczepionki na rynek. „Najlepsza wiadomosc w okresie pandemii”&nbsp;&nbsp;DW (Polski)","https://www.dw.com/pl/biontech-i-pfizer-bliskie-wypuszczenia-szczepionki-na-rynek-najlepsza-wiadomo%C5%9B%C4%87-w-okresie-pandemii/a-55548170"
"22",2021-01-20 17:43:26,"BioNTech i Pfizer maja szczepionke na COVID-19. To sukces firmy tureckich imigrantów - Money.pl","BioNTech i Pfizer maja szczepionke na COVID-19. To sukces firmy tureckich imigrantów&nbsp;&nbsp;Money.pl","https://www.money.pl/gospodarka/biontech-i-pfizer-maja-szczepionke-na-covid-19-to-sukces-firmy-tureckich-imigrantow-6573801326103424a.html"
"23",2021-01-20 17:43:26,"Pfizer i BioNTech o skutecznosci swojej szczepionki - politykazdrowotna.com","Pfizer i BioNTech o skutecznosci swojej szczepionki&nbsp;&nbsp;politykazdrowotna.com","https://www.politykazdrowotna.com/61278,pfizer-i-biontech-o-skutecznosci-swojej-szczepionki"
"24",2021-01-20 17:43:26,"EMA dopuscila do obrotu szczepionke przeciw COVID-19 firm BioNTech i Pfizer - Parkiet","EMA dopuscila do obrotu szczepionke przeciw COVID-19 firm BioNTech i Pfizer&nbsp;&nbsp;Parkiet","https://www.parkiet.com/Gospodarka---Swiat/312219870-EMA-dopuscila-do-obrotu-szczepionke-przeciw-COVID-19-firm-BioNTech-i-Pfizer.html"
"25",2021-01-20 17:43:26,"KE chce zakupic do 300 mln szczepionek COVID od Pfizer i BioNTech - politykazdrowotna.com","KE chce zakupic do 300 mln szczepionek COVID od Pfizer i BioNTech&nbsp;&nbsp;politykazdrowotna.com","https://www.politykazdrowotna.com/64042,ke-chce-zakupic-do-300-mln-szczepionek-covid-od-pfizer-i-biontech"
"26",2021-01-20 17:43:26,"EMA: Firmy Pfizer, BioNTech i Moderna przedstawily bardzo solidne dane w sprawie szczepionek na Covid-19 - Bankier.pl","EMA: Firmy Pfizer, BioNTech i Moderna przedstawily bardzo solidne dane w sprawie szczepionek na Covid-19&nbsp;&nbsp;Bankier.pl","https://www.bankier.pl/wiadomosc/EMA-Firmy-Pfizer-BioNTech-i-Moderna-przedstawily-bardzo-solidne-dane-w-sprawie-szczepionek-na-Covid-19-8018303.html"
"27",2021-01-20 17:43:26,"Pfizer i BioNTech. Czy szczepionka na koronawirusa zakonczy swiatowa pandemie? - Money.pl","Pfizer i BioNTech. Czy szczepionka na koronawirusa zakonczy swiatowa pandemie?&nbsp;&nbsp;Money.pl","https://www.money.pl/gospodarka/pfizer-i-biontech-czy-szczepionka-na-koronawirusa-zakonczy-swiatowa-pandemie-6582282634979904a.html"
"28",2021-01-20 17:43:26,"Szczepionka Pfizer BioNTech jest skuteczna i bezpieczna - Termedia","Szczepionka Pfizer BioNTech jest skuteczna i bezpieczna&nbsp;&nbsp;Termedia","https://www.termedia.pl/koronawirus/Szczepionka-Pfizer-BioNTech-jest-skuteczna-i-bezpieczna,40668.html"
"29",2021-01-20 17:43:26,"USA: umowa z Pfizer i BioNtech na 100 mln dawek szczepionki - politykazdrowotna.com","USA: umowa z Pfizer i BioNtech na 100 mln dawek szczepionki&nbsp;&nbsp;politykazdrowotna.com","https://www.politykazdrowotna.com/62033,usa-umowa-z-pfizer-i-biontech-na-100-mln-dawek-szczepionki"
"30",2021-01-20 17:43:26,"Europejska Agencja Leków wyda opinie o szczepionce firm Pfizer/BioNTech - Bankier.pl","Europejska Agencja Leków wyda opinie o szczepionce firm Pfizer/BioNTech&nbsp;&nbsp;Bankier.pl","https://www.bankier.pl/wiadomosc/Europejska-Agencja-Lekow-wyda-opinie-o-szczepionce-firm-Pfizer-BioNTech-8021368.html"
"31",2021-01-20 17:43:26,"Pfizer i BioNTech zakonczyly prace nad szczepionka - PulsBiznesu","Pfizer i BioNTech zakonczyly prace nad szczepionka&nbsp;&nbsp;PulsBiznesu","https://www.pb.pl/pfizer-i-biontech-zakonczyly-prace-nad-szczepionka-1101069"
"32",2021-01-20 17:43:26,"Pfizer i BioNTech wystapily do EMA o autoryzacje szczepionki przeciw COVID-19 - Puls Medycyny","Pfizer i BioNTech wystapily do EMA o autoryzacje szczepionki przeciw COVID-19&nbsp;&nbsp;Puls Medycyny","https://pulsmedycyny.pl/pfizer-i-biontech-wystapily-do-ema-o-autoryzacje-szczepionki-przeciw-covid-19-1102083"
"33",2021-01-20 17:43:26,"Bahrajn jako drugi kraj na swiecie dopuszcza do uzycia szczepionke Pfizer/BioNTech - Bankier.pl","Bahrajn jako drugi kraj na swiecie dopuszcza do uzycia szczepionke Pfizer/BioNTech&nbsp;&nbsp;Bankier.pl","https://www.bankier.pl/wiadomosc/Bahrajn-jako-drugi-kraj-na-swiecie-dopuszcza-do-uzycia-szczepionke-Pfizer-BioNTech-8014988.html"
"34",2021-01-20 17:43:26,"BioNTech: Ugur Sahin i Özlem Türeci. Bez nich nie byloby pierwszej szczepionki przeciwko SARS-CoV-2 - EURACTIV Poland","BioNTech: Ugur Sahin i Özlem Türeci. Bez nich nie byloby pierwszej szczepionki przeciwko SARS-CoV-2&nbsp;&nbsp;EURACTIV Poland","https://www.euractiv.pl/section/migracje/news/pfizer-biontech-ugur-sahin-ozlem-tureci-szczepionka-covid19-migranci-niemcy/"
"35",2021-01-20 17:43:26,"BioNTech i Pfizer maja potencjalna szczepionke przeciwko COVID-19 - Puls Farmacji","BioNTech i Pfizer maja potencjalna szczepionke przeciwko COVID-19&nbsp;&nbsp;Puls Farmacji","https://pulsfarmacji.pl/4752547,6486,biontech-i-pfizer-maja-potencjalna-szczepionke-przeciwko-covid-19"
"36",2021-01-20 17:43:26,"Grafika nie przekazuje prawdziwych tresci z ulotki od Pfizera i BioNTech - DEMAGOG","Grafika nie przekazuje prawdziwych tresci z ulotki od Pfizera i BioNTech&nbsp;&nbsp;DEMAGOG","https://demagog.org.pl/fake_news/grafika-nie-przekazuje-prawdziwych-tresci-z-ulotki-od-pfizera-i-biontech/"
"37",2021-01-20 17:43:26,"Co wiadomo o szczepionce Pfizer/BioNTech COVID-19? Wbrew pozorom DUZO - Super Express","Co wiadomo o szczepionce Pfizer/BioNTech COVID-19? Wbrew pozorom DUZO&nbsp;&nbsp;Super Express","https://www.se.pl/zdrowie/co-wiadomo-o-szczepionce-pfizer-biontech-covid-19-wbrew-pozorom-duzo-aa-Ycy2-w6qg-nvCS.html"
"38",2021-01-20 17:43:26,"Wielka Brytania rozpoczyna szczepienia na COVID-19 - BusinessInsider","Wielka Brytania rozpoczyna szczepienia na COVID-19&nbsp;&nbsp;BusinessInsider","https://businessinsider.com.pl/wiadomosci/wielka-brytania-szczepienia-obywateli-na-covid-19-szczepionka-pfizer-biontech/ftmqclk"
"39",2021-01-20 17:43:26,"Druga szczepionka na koronawirusa zatwierdzona w USA. Najpierw Pfizer i BioNTech, teraz Moderna - TVN24","Druga szczepionka na koronawirusa zatwierdzona w USA. Najpierw Pfizer i BioNTech, teraz Moderna&nbsp;&nbsp;TVN24","https://tvn24.pl/swiat/druga-szczepionka-na-koronawirusa-zatwierdzona-w-usa-najpierw-pfizer-i-biontech-teraz-moderna-4780294"
"40",2021-01-20 17:43:26,"Amerykanska agencja przyspiesza badanie szczepionek. Jeszcze w tym miesiacu moga odbyc sie duze testy - BusinessInsider","Amerykanska agencja przyspiesza badanie szczepionek. Jeszcze w tym miesiacu moga odbyc sie duze testy&nbsp;&nbsp;BusinessInsider","https://businessinsider.com.pl/wiadomosci/szczepionka-na-koronawirusa-od-pfizer-i-biontech-z-oznaczeniem-fast-track/ez2jskl"
"41",2021-01-20 17:43:26,"Dlaczego szef firmy Pfizer sie jeszcze nie zaszczepil? - politykazdrowotna.com","Dlaczego szef firmy Pfizer sie jeszcze nie zaszczepil?&nbsp;&nbsp;politykazdrowotna.com","https://www.politykazdrowotna.com/68286,dlaczego-szef-firmy-pfizer-sie-jeszcze-nie-zaszczepil"
"42",2021-01-20 17:43:26,"Szczepionka Pfizer Biontech ma 95 procent skutecznosci u doroslych powyzej 65 roku zycia - Wiadomosci Radio Zet","Szczepionka Pfizer Biontech ma 95 procent skutecznosci u doroslych powyzej 65 roku zycia&nbsp;&nbsp;Wiadomosci Radio Zet","https://wiadomosci.radiozet.pl/Koronawirus/Szczepionka-Pfizer-Biontech-ma-95-procent-skutecznosci-u-doroslych-powyzej-65-roku-zycia"
"43",2021-01-20 17:43:26,"Pfizer i BioNTech beda wspólnie pracowac nad szczepionka na koronawirusa - rynki zagraniczne - WNP.PL","Pfizer i BioNTech beda wspólnie pracowac nad szczepionka na koronawirusa - rynki zagraniczne&nbsp;&nbsp;WNP.PL","https://www.wnp.pl/rynki-zagraniczne/pfizer-i-biontech-beda-wspolnie-pracowac-nad-szczepionka-na-koronawirusa,379556.html"
"44",2021-01-20 17:43:26,"Pfizer oraz BioNTech rozpoczynaja wspólprace nad szczepionka na koronawirusa - Medexpress.pl","Pfizer oraz BioNTech rozpoczynaja wspólprace nad szczepionka na koronawirusa&nbsp;&nbsp;Medexpress.pl","https://www.medexpress.pl/pfizer-oraz-biontech-rozpoczynaja-wspolprace-nad-szczepionka-na-koronawirusa/76800"
"45",2021-01-20 17:43:26,"Próbujac obiektywnie spojrzec na szczepionke przeciw COVID-19 Pfizer/BioNTech - TVP Info","Próbujac obiektywnie spojrzec na szczepionke przeciw COVID-19 Pfizer/BioNTech&nbsp;&nbsp;TVP Info","https://www.tvp.info/51213041/probujac-obiektywnie-spojrzec-na-szczepionke-przeciw-covid-19-pfizerbiontech"
"46",2021-01-20 17:43:26,"W Polsce 2 mld zl poszlo na TVP, Niemcy daly tyle Pfizerowi, by wyprodukowal szczepionke - Spider's Web","W Polsce 2 mld zl poszlo na TVP, Niemcy daly tyle Pfizerowi, by wyprodukowal szczepionke&nbsp;&nbsp;Spider's Web","https://spidersweb.pl/bizblog/szczepionka-na-covid-19-pfizer-biontech/"
"47",2021-01-20 17:43:26,"""Pomysl szczepionki powstal przy sniadaniu"". Wynalazcy z Biontech rozmawiali z Merkel - DW (Polski)","""Pomysl szczepionki powstal przy sniadaniu"". Wynalazcy z Biontech rozmawiali z Merkel&nbsp;&nbsp;DW (Polski)","https://www.dw.com/pl/szczepionka-merkel-biontech/a-55978683"
"48",2021-01-20 17:43:26,"Do przechowywania szczepionek przeciwko COVID-19 wystarczy zwykla lodówka - TVP Info","Do przechowywania szczepionek przeciwko COVID-19 wystarczy zwykla lodówka&nbsp;&nbsp;TVP Info","https://www.tvp.info/50796581/covid-19-do-przechowywania-szczepionek-wystarczy-zwykla-lodowka"
"49",2021-01-20 17:43:26,"Niemcy bez entuzjazmu wobec szczepionki - DW (Polski)","Niemcy bez entuzjazmu wobec szczepionki&nbsp;&nbsp;DW (Polski)","https://www.dw.com/pl/https-wwwdwcom-pl-niemcy-szczepionka-covid-biontech-antyszczpionkowcy/a-55578863"
